{
  "schema_version": "sourceos.incident.v0.1",
  "incident_id": "inc_bearbrowser_identity_leak_seed",
  "incident_class": "identity_mismatch",
  "created_at": "2026-05-05T00:00:00-04:00",
  "summary": "Browser product identity leaked upstream Firefox identity through launch/process surfaces.",
  "risk": "medium",
  "causal_graph": {
    "root_event_id": "evt_bearbrowser_launch_identity_mismatch",
    "suspected_causes": [
      "LaunchServices registration still maps active process to upstream bundle identity",
      "helper processes retain upstream names",
      "profile path contains upstream identity",
      "launcher invokes upstream binary without product wrapper identity seal"
    ]
  },
  "affected_services": [
    "dev.sourceos.bearbrowser"
  ],
  "policy_context": {
    "required_invariant": "No upstream identity leakage on product surfaces.",
    "remediation_policy": "Fail release if dock, menu, crash, process, helper, or profile identity exposes upstream product name."
  },
  "resource_context": {
    "evidence_classes": [
      "launchd job labels",
      "dock/menu identity",
      "crash reporter name",
      "profile path",
      "launcher environment"
    ]
  },
  "privacy": {
    "tier": "admin_forensic",
    "redaction_policy": "preserve_causality"
  },
  "export_policy": {
    "exportable": false,
    "requires_approval": true
  }
}
